{
  "schema_version": 1,
  "slug": "pigeon-trash",
  "name": "Pigeon Trash",
  "status": "active",
  "repository": "WelshPigeon/pigeon-trash",
  "version": "1.2.1",
  "tag": "v1.2.1",
  "released_at": "2026-06-26",
  "title": "Legacy dumpster inventory compatibility",
  "notes": [
    "Fixed legacy dumpster inventory compatibility.",
    "Preserved existing ox_inventory stash identifiers.",
    "Disabled automatic coordinate stash rewrites during migrations.",
    "Added legacy coordinate fallback lookup.",
    "Added safe existing dumpster lookup priority.",
    "Fixed old dumpster inventories opening as empty.",
    "Fixed duplicate insert attempts for existing dumpsters.",
    "Improved backwards compatibility with legacy garbage_bins data.",
    "Protected existing dumpster contents during migration."
  ],
  "links": {
    "support": "https://pigeonstudios.co.uk"
  }
}
